{"model_id":"adtof-frame-rnn","version":"adtofAll_0-pt-85c192e","method":"isotonic","knots":[[0.021757,0.0],[0.029612,0.294118],[0.036127,0.545455],[0.080058,0.586873],[0.198965,0.643885],[0.303315,0.705882],[0.33539,0.720588],[0.35812,0.752577],[0.381503,0.788732],[0.402976,0.793478],[0.427032,0.826923],[0.439557,0.857143],[0.457312,0.894366],[0.524824,0.902357],[0.589628,0.922018],[0.621445,0.935],[0.686604,0.935374],[0.776458,0.946085],[0.82576,0.970149],[0.837622,0.984375],[0.86306,0.992366],[0.904688,1.0]],"bands":{"high":0.7,"medium":0.4},"fitted_on":"p2d-shipped-chosen-fit"}
