{"model_id":"basic-pitch","version":"0.4.0","method":"isotonic","knots":[[0.222772,0.0],[0.561937,0.185185],[0.65066,0.4],[0.6554,0.5],[0.674678,0.611111],[0.71083,0.787879],[0.73656,0.8],[0.75746,0.82],[0.779775,0.875],[0.809222,0.953488],[0.84568,0.957895],[0.870968,0.964286],[0.89376,1.0]],"bands":{"high":0.7,"medium":0.4},"fitted_on":"p2-babyslakh-01-10-stems"}
