{"model_id":"basic-pitch","version":"0.4.0","method":"isotonic","knots":[[0.073388,0.0],[0.097848,0.04],[0.108086,0.071429],[0.143922,0.11875],[0.1753,0.166667],[0.181882,0.179487],[0.1901,0.25],[0.207825,0.26087],[0.235198,0.3125],[0.248117,0.333333],[0.274958,0.351351],[0.309117,0.361111],[0.389119,0.388],[0.453162,0.482759],[0.467779,0.510638],[0.474978,0.518519],[0.49315,0.553398],[0.507119,0.571429],[0.524665,0.60303],[0.544322,0.641667],[0.554459,0.65285],[0.569728,0.672414],[0.595399,0.717899],[0.613088,0.736264],[0.621092,0.748634],[0.634925,0.807692],[0.654869,0.808602],[0.674408,0.837079],[0.693143,0.860887],[0.729953,0.902199],[0.758506,0.9125],[0.761429,0.916667],[0.775508,0.934919],[0.791777,0.946429],[0.797013,0.948454],[0.835046,0.954293],[0.892937,0.978328],[0.916396,0.979592],[0.930947,1.0]],"bands":{"high":0.7,"medium":0.4},"fitted_on":"p2-guitarset-players-00-02-stems"}
