{"model_id":"guitab-e25","version":"1.1.1-e25","method":"isotonic","knots":[[0.453071,0.357143],[0.494622,0.442982],[0.53465,0.5],[0.542302,0.534884],[0.575105,0.537313],[0.609556,0.603175],[0.622347,0.627907],[0.64851,0.638614],[0.670175,0.7],[0.691876,0.728889],[0.740294,0.778781],[0.772178,0.822222],[0.797633,0.849099],[0.830014,0.862816],[0.841395,0.871795],[0.8438,0.888889],[0.846469,0.90625],[0.853837,0.911392],[0.874753,0.941374],[0.898354,0.947761],[0.908809,0.956044],[0.944939,0.968297]],"bands":{"high":0.7,"medium":0.4},"fitted_on":"p2g-fit-split-stems"}
