{"model_id":"transkun-v2","version":"2.0.1","method":"isotonic","knots":[[0.335667,0.0],[0.372567,0.333333],[0.422191,0.342105],[0.447873,0.431818],[0.457089,0.444444],[0.45875,0.5],[0.482007,0.568889],[0.50518,0.59375],[0.513954,0.684211],[0.517671,0.714286],[0.519402,0.758065],[0.524321,0.789916],[0.530896,0.814607],[0.536753,0.896861],[0.54173,0.90625],[0.545915,0.926471],[0.549637,0.932384],[0.556193,0.945024],[0.561599,0.965909],[0.563031,0.966942],[0.5677,0.967843],[0.575754,0.972564],[0.590549,0.977703],[0.607184,0.98125],[0.616081,0.989101],[0.634074,1.0]],"bands":{"high":0.7,"medium":0.4},"fitted_on":"p2p-final-chosen-fit"}
